{
  "complete": true,
  "counts": {
    "entities": 2,
    "serializedBytes": 420,
    "shards": 2
  },
  "indexSha256": "3dbdfa0c6f3c5159129f6eae06b62fb44746fe0dad0bf70632628229b0622d6e",
  "runSha256": "01f7d381e08676528d873ecf6be1e2a0aa2659ea4b2befa33625d01444d71d24",
  "schemaVersion": 1,
  "shards": [
    {
      "entities": 1,
      "inputSha256": "1111111111111111111111111111111111111111111111111111111111111111",
      "outputBytes": 210,
      "outputSha256": "c5c3b58fac58ac3fdb9701aabcec4316af91660cba012117b714811607ceb264",
      "runSha256": "01f7d381e08676528d873ecf6be1e2a0aa2659ea4b2befa33625d01444d71d24",
      "schemaVersion": 1,
      "shardId": "alpha",
      "status": "complete"
    },
    {
      "entities": 1,
      "inputSha256": "2222222222222222222222222222222222222222222222222222222222222222",
      "outputBytes": 210,
      "outputSha256": "11b828e10169186e82ef4b590bb15dd7b8362fd4c0a4f8974d5118f6273cd41b",
      "runSha256": "01f7d381e08676528d873ecf6be1e2a0aa2659ea4b2befa33625d01444d71d24",
      "schemaVersion": 1,
      "shardId": "omega",
      "status": "complete"
    }
  ]
}
