{
  "complete": true,
  "counts": {
    "entities": 10,
    "serializedBytes": 11044,
    "shards": 2
  },
  "indexSha256": "11934bc16a3571b67c5e3c4404e4dddb8160c9150926aee32e98a97a14c86203",
  "runSha256": "565beb1db22e62df6db4550a1f939c5bf6f87afc019be9e8b6bb5dddc18caaf2",
  "schemaVersion": 1,
  "shards": [
    {
      "entities": 2,
      "inputSha256": "ceaf5d42f1699edc64b8293d85e5d8591ba968a94107a0159f665e7d7718df54",
      "outputBytes": 2649,
      "outputSha256": "0cb03850570c0f8296c5a3f4e59daa112367202a5c0972f1e05f452d5a09cfc7",
      "runSha256": "565beb1db22e62df6db4550a1f939c5bf6f87afc019be9e8b6bb5dddc18caaf2",
      "schemaVersion": 1,
      "shardId": "clang-lib-driver",
      "status": "complete"
    },
    {
      "entities": 8,
      "inputSha256": "0cad64f42fc3d48e468d32a500544bb7926a3ec388a55e94040da7bc9f33dc13",
      "outputBytes": 8395,
      "outputSha256": "bc040ed53a452df499ec6a5656680ebd7d3e3e4de067170f8cfcfe291348dac9",
      "runSha256": "565beb1db22e62df6db4550a1f939c5bf6f87afc019be9e8b6bb5dddc18caaf2",
      "schemaVersion": 1,
      "shardId": "generated-tools-clang",
      "status": "complete"
    }
  ]
}
